<?xml version="1.0" encoding="UTF-8"?>
<!ELEMENT channel (name, topic+)>
<!ELEMENT topic (name, tutorial+)>
<!ELEMENT name (#PCDATA)>
<!ELEMENT tutorial (#PCDATA)>